{
  "schemaVersion": "1.0",
  "component": { "mpn": "REF-X", "manufacturer": "Y", "family": "voltage_reference" },
  "parameters": [
    { "key": "output_voltage", "measurements": [
      { "limitClass": "characterized", "value": { "min": 2.499, "typ": 2.5, "max": 2.501 }, "unit": "V",
        "conditions": [ { "param": "T_A", "value": 25, "unit": "degC" } ], "sourcePage": 4,
        "guarantee": "production_tested", "review": "confirmed", "confidence": 0.95 } ] },
    { "key": "output_noise", "measurements": [
      { "limitClass": "characterized", "value": { "typ": 0.00000125 }, "unit": "V",
        "conditions": [ { "param": "BW_LOW", "value": 0.1, "unit": "Hz" }, { "param": "BW_HIGH", "value": 10, "unit": "Hz" } ],
        "sourcePage": 4, "guarantee": "typical", "review": "unchecked", "confidence": 0.6 } ] }
  ],
  "provenance": { "verified": false }
}
